{
  "contractVersion": "1.0",
  "projectId": "5f0c9d8e-3a47-4b21-9f6a-8c2d1e4b7a30",
  "name": "Warehouse B — mezzanine as-built",
  "description": "Existing-facility capture for as-built documentation of the mezzanine structure and connections.",
  "createdAt": "2026-09-01T08:30:00Z",
  "updatedAt": "2026-09-02T10:15:00Z"
}
